produkty__ID;prod__nazwa;prod__opis
1;Komfort Życia;Ubezpieczenie na życie
2;Emerytura bez Obaw;Ubezpieczenie na życie z odkładaniem kapitału
3;Start w Życie;Ubezpieczenie na życie dziecka z odkładaniem kapitału na start w życie
4;Oszczędności bez Obaw;Ubezpieczenie oszczędnościowe
5;Pewny Kapitał;Ubezpieczenie na życie z odkładaaniem kapitału
6;Ubezpieczenie Dodatkowe na wypadek Śmierci;Ubezpieczenie Dodatkowe na wypadek Śmierci
8;Ubezp Dod na wypadek Śmierci w NW;Ubezpieczenie Dodatkowe na wypadek Śmierci w nieszczęśliwym wypadku
11;Ubezp Dod na wyp niezd. do pracy;Ubezpieczenie Dodatkowe na wyp niezd. do pracy
14;;
